Keyword,Volume,Keyword Difficulty,CPC,Traffic,Traffic potential,Parent Keyword
girls basketball training program,4200,15,0.62,2100,3700,training program girls
girls basketball workout plan,3600,14,0.58,1800,3150,workout plan girls
girls basketball training schedule,2800,12,0.52,1400,2450,schedule girls
weekly basketball training girls,2200,11,0.48,1100,1925,weekly girls
daily basketball routine for girls,2400,10,0.45,1200,2100,daily routine girls
30 day basketball training girls,1800,10,0.45,900,1575,30 day girls
summer basketball training program girls,2600,13,0.55,1300,2275,summer program girls
off season basketball training girls,2200,12,0.52,1100,1925,off season girls
preseason basketball training girls,1800,13,0.55,900,1575,preseason girls
in season basketball maintenance girls,1200,11,0.48,600,1050,in season girls
girls basketball strength program,1600,13,0.55,800,1400,strength program girls
girls basketball conditioning program,1800,12,0.52,900,1575,conditioning program girls
girls basketball speed training program,1400,12,0.52,700,1225,speed program girls
girls basketball agility program,1600,11,0.48,800,1400,agility program girls
girls basketball vertical jump program,1400,13,0.55,700,1225,vertical program girls
girls basketball shooting program,2200,12,0.52,1100,1925,shooting program girls
girls basketball handles program,1800,11,0.48,900,1575,handles program girls
girls basketball complete training system,1200,14,0.58,600,1050,complete system girls
girls aau basketball training program,2400,15,0.62,1200,2100,aau program girls
travel basketball training program girls,1800,14,0.58,900,1575,travel program girls
girls basketball varsity preparation,1400,13,0.55,700,1225,varsity prep girls
girls basketball college prep training,1800,16,0.65,900,1575,college prep girls
d1 basketball training program girls,1600,17,0.68,800,1400,d1 program girls
girls basketball scholarship training,1200,15,0.62,600,1050,scholarship girls
elite girls basketball development program,1400,16,0.65,700,1225,elite development girls
girls basketball year round training,1600,12,0.52,800,1400,year round girls
girls basketball progressive training,1200,10,0.45,600,1050,progressive girls
girls basketball skill building program,1800,11,0.48,900,1575,skill building girls
girls basketball fundamentals program,2200,10,0.45,1100,1925,fundamentals program girls
beginner to advanced girls basketball,1400,9,0.42,700,1225,beginner advanced girls
