Keyword,Volume,Keyword Difficulty,CPC,Traffic,Traffic potential,Parent Keyword
basketball drills for 10 year olds,2400,15,0.50,1200,3000,basketball drills
"quiet basketball drills, apartment friendly",1800,8,0.25,900,1500,basketball drills
how to fix shooting form basketball,4800,22,0.75,2400,5000,shooting form
barefoot training benefits kids,800,6,0.10,400,800,barefoot training
youth basketball footwork drills,1200,12,0.45,600,1000,basketball footwork
"dribbling drills for kids, no hoop needed",950,9,0.30,475,800,dribbling drills
best ankle strengthening exercises youth athletes,650,11,0.55,325,550,ankle exercises
home basketball training without hoop,2100,14,0.40,1050,1800,basketball training
sever's disease exercises for kids,1400,7,0.20,700,1200,severs disease
basketball agility drills 8 year old,890,10,0.35,445,750,agility drills
indoor basketball drills small space,1650,13,0.42,825,1400,indoor drills
"youth speed training, at home",720,8,0.28,360,600,speed training
ball handling drills for beginners,3200,18,0.65,1600,2800,ball handling
how to improve crossover dribble kids,1100,11,0.38,550,900,crossover dribble
flat feet exercises for young athletes,480,5,0.15,240,400,flat feet exercises
